SẢN PHẨM,NGÀNH HÀNG,GIÁ NY,GIÁ KM NORMAL,GIÁ KM CAMP,Chênh lệch giá so với KM,% GIẢM NORMAL,% GIẢM NY,Số Lượng MAX có thể bán,Note,Website GVN,Đánh giá Deal
Thiết bị kết nối chuột không dây Pulsar 8K Dongle Black,Peri,"529,000","499,000","9,000","490,000",98%,98%,9,,,Layer 02
Phụ kiện Razer RIPSAW,Peri,"4,490,000","4,390,000","90,000","4,300,000",98%,98%,1,,,Layer 01
Tai nghe HP HyperX Cloud III Wireless Red,Peri,"4,390,000","3,290,000","99,000","3,191,000",97%,98%,15,,https://gearvn.com/products/tai-nghe-hp-hyperx-cloud-iii-wireless-red,Layer 01
Củ Sạc Ugreen PD 20W Bl CD137 50799,Peri,"460,000","170,000","10,000","160,000",94%,98%,6,,,Layer 02
Lót chuột AKKO Mini Pad Corgi Butt,Peri,"179,000","90,000","10,000","80,000",89%,94%,10,,,Layer 02
Cổng chuyển HyperDrive 6 in 1 4K60Hz for iMac 24 HD34A8,Peri,"1,590,000","1,590,000","190,000","1,400,000",88%,88%,6,,,Layer 02
Cổng chuyển HyperDrive 5 in 1 for iMac 24 HD34A6,Peri,"690,000","690,000","90,000","600,000",87%,87%,7,,,Layer 02
Sạc nhanh Ugreen Robot CD361 15570 3 cổng USB-C và USB-A GaN 65W (SpaceGray),Peri,"900,000","630,000","90,000","540,000",86%,90%,7,,,Layer 02
Sạc nhanh Ugreen Robot CD361 35314 cổng USB-C và USB-A GaN 65W (Tím),Peri,"900,000","630,000","90,000","540,000",86%,90%,11,,,Layer 02
Kê chân công thái học Warrior Ergonomic Footrest WEF101,Peri,"599,000","599,000","90,000","509,000",85%,85%,70,,,Layer 02
ROG Gaming Charger Dock,Peri,"1,690,000","1,690,000","290,000","1,400,000",83%,83%,9,,,Layer 01
Chuột Pulsar có dây X2 Medium White,Peri,"1,390,000","990,000","190,000","800,000",81%,86%,2,,,Layer 02
Lót chuột TeamGroup,Peri,"100,000","100,000","20,000","80,000",80%,80%,100,,,Layer 02
Quạt du lịch cầm tay Jisulife Super mini Turbo fan FA42 White J2170,Peri,"350,000","190,000","40,000","150,000",79%,89%,137,,,Layer 02
Lót chuột AKKO King's Avatar-Ye Xiu,Peri,"450,000","450,000","100,000","350,000",78%,78%,30,,,Layer 02
Quạt du lịch cầm tay Jisulife F2B White J1975,Peri,"320,000","160,000","40,000","120,000",75%,88%,10,,,Layer 02
Quạt du lịch cầm tay Jisulife F2B Blue J1999,Peri,"320,000","160,000","40,000","120,000",75%,88%,10,,,Layer 02
Quạt du lịch cầm tay Jisulife F2B Pink J1982,Peri,"320,000","160,000","40,000","120,000",75%,88%,14,,,Layer 02
Tay cầm chơi game Razer Wolverine V2 Chroma White (Xbox Series X/S),Peri,"4,490,000","3,290,000","990,000","2,300,000",70%,78%,1,,,Layer 01
Chuột AKKO Smart 1 Sailor Moon,Peri,"369,000","290,000","90,000","200,000",69%,76%,100,,,Layer 02
RAM-GSK-TRIDENTZ-RGB-1X16GB-5600-BLK-DDR5,RAM,"5,995,000","5,995,000","1,990,000","4,005,000",67%,67%,1,,,Layer 01
MB-GIG-X299X-AORUS-MAS,Mainboard,"12,990,000","11,990,000","3,990,000","8,000,000",67%,69%,1,,https://gearvn.com/products/x299x-aorus-master-rev-1-0,Layer 01
Lót chuột GEARVN Da Pu Hồng (450x400x2),Peri,"190,000","60,000","20,000","40,000",67%,89%,90,,,Layer 02
Lót chuột Corsair MM500 V2 Large,Peri,"900,000","850,000","290,000","560,000",66%,68%,13,,,Layer 02
RAM-GSK-TRIDENTZ-RGB-1X16GB-5600-BLK-DDR5-CL30,RAM,"5,590,000","5,590,000","1,990,000","3,600,000",64%,64%,1,,,Layer 01
Tai nghe Onikuma Tai Mèo B5 RGB Tri Mode Trắng,Peri,"1,190,000","990,000","390,000","600,000",61%,67%,14,,,Layer 02
Tai nghe Onikuma Tai Mèo B5 RGB Tri Mode Hồng,Peri,"1,190,000","990,000","390,000","600,000",61%,67%,7,,,Layer 02
Máy lọc không khí Honeywell Air Touch V1,Peri,"1,250,000","700,000","290,000","410,000",59%,77%,9,,https://gearvn.com/products/may-loc-khong-khi-honeywell-air-touch-v1,Layer 01
RAM-KING-FURY-BEAST-RGB-32GB-6000-DDR5,RAM,"2,990,000","2,990,000","1,290,000","1,700,000",57%,57%,2,,,Layer 01
Bàn phím AKKO ACR Pro Alice Plus Spray Paint White AKKO CS switch,Peri,"2,990,000","2,990,000","1,290,000","1,700,000",57%,57%,30,,,Layer 02
Ghế Ergonomic Warrior Hero series WEC509 Black/Red,Peri,"4,390,000","3,390,000","1,490,000","1,900,000",56%,66%,6,,,Layer 01
"Màn hình ViewSonic VA2215-H 22"" 100Hz FHD",LCD,"3,600,000","1,590,000","1,490,000","100,000",56%,59%,KGH,,,Layer 02
Chuột ASUS ROG Strix Impact III Wireless White,Peri,"2,200,000","1,090,000","490,000","600,000",55%,78%,15,,,Layer 02
RAM-TEAM-DELTA-1x8G-3600-RGB-BLACK,RAM,"2,190,000","2,190,000","990,000","1,200,000",55%,55%,1,,,Layer 01
RAM-TEAM-DELTA-1x8G-3600-RGB-WHITE,RAM,"2,190,000","2,190,000","990,000","1,200,000",55%,55%,1,,,Layer 01
Bàn phím Leobog Hi86 TM (Trắng đen/ Nimbus V3 switch) HI8602,Peri,"2,600,000","2,090,000","990,000","1,100,000",53%,62%,2,,https://gearvn.com/products/ban-phim-leobog-hi86-tm-trang-den-nimbus-v3-switch?srsltid=AfmBOopPytoEl8yDb7aZLAAIXwjSXez4OT4zfUdJGun2zVtqbvf8QEMn,Layer 01
Loa Edifier Bluetooth ES300 Ivory,Peri,"4,990,000","4,190,000","1,990,000","2,200,000",53%,60%,5,,,Layer 02
Loa Edifier Bluetooth ES300 Black,Peri,"4,990,000","4,190,000","1,990,000","2,200,000",53%,60%,2,,,Layer 02
Chuột Logitech G502 Hero Gaming,Peri,"1,090,000","820,000","390,000","430,000",52%,64%,15,,https://gearvn.com/products/logitech-g502-hero,Layer 01
RAM-KING-FURY-1X16-3600-RGB-HX436C18FB4AK2-32,RAM,"2,990,000","2,695,000","1,290,000","1,405,000",52%,57%,1,,,Layer 01
"Màn hình LG 27GR93U-B UltraGear 27"" IPS 4K 144Hz Gsync chuyên game",LCD,"19,990,000","9,690,000","8,290,000","1,400,000",52%,59%,KGH,,,Layer 02
Camera WIFI UNV IPC-S3E-M3 (3MP - Quay quét - Đàm thoại 2 chiều),Peri,"690,000","390,000","190,000","200,000",51%,72%,20,,,Layer 02
MB-GIG-Z790-AORUS-XTRE-X-ICE-D5,Mainboard,"49,990,000","40,990,000","19,990,000","21,000,000",51%,60%,2,,https://gearvn.com/products/bo-mach-chu-gigabyte-z790-aorus-xtreme-x-ice,Layer 02
"Màn hình Asus ROG Strix XG27AQDMG 27"" WOLED 2K 240Hz HDR10 Gsync chuyên game",LCD,"29,990,000","15,590,000","14,490,000","1,100,000",48%,52%,KGH,,,Layer 02
"Màn hình ViewSonic VX2882-4KP 28"" IPS 4K 150Hz HDR10 USBC",LCD,"15,990,000","8,390,000","3,990,000","4,400,000",48%,75%,2,,,Layer 01
"Màn hình ViewSonic VX2882-4KP 28"" IPS 4K 150Hz HDR10 USBC",LCD,"15,990,000","8,390,000","7,690,000","700,000",48%,52%,10,,,Layer 02
Loa Onikuma Bluetooth L7 RGB kèm Micro Trắng,Peri,"890,000","740,000","390,000","350,000",47%,56%,5,,,Layer 02
Loa Onikuma Bluetooth L7 RGB kèm Micro Đen,Peri,"890,000","740,000","390,000","350,000",47%,56%,5,,,Layer 02
"Màn hình Asus ROG Strix XG27AQDMG 27"" WOLED 2K 240Hz HDR10 Gsync chuyên game",LCD,"29,990,000","15,990,000","99,000","15,891,000",47%,100%,1,,,Bốc Thăm - Cuối Ngày
Lót chuột Razer Acari,Peri,"1,490,000","1,490,000","800,000","690,000",46%,46%,5,,,Layer 02
Chuột AULA SC800 Black 3 MODE 8K (SC80002),Peri,"1,319,000","1,090,000","590,000","500,000",46%,55%,7,,,Layer 02
Sạc dự phòng Recci RPB-P12C Blue,Peri,"470,000","350,000","190,000","160,000",46%,60%,7,,,Layer 02
Loa Edifier Bluetooth ES20 Black,Peri,"1,490,000","890,000","490,000","400,000",45%,67%,6,,,Layer 02
Bộ sạc nhanh GaN 100W Ugreen CD226 15336 (Trắng),Peri,"1,490,000","890,000","490,000","400,000",45%,67%,4,,,Layer 02
Bàn phím AKKO YU01 Antique Jade V3 Piano Pro switch,Peri,"3,390,000","2,850,000","1,590,000","1,260,000",44%,53%,11,,,Layer 02
"Màn hình di động Asus ZenScreen MB169CK 16"" IPS FHD USBC",LCD,"4,990,000","2,790,000","2,590,000","200,000",44%,48%,KGH,,,Layer 02
Bàn phím AKKO YU01 White Jade V3 Piano Pro switch,Peri,"3,390,000","2,790,000","1,590,000","1,200,000",43%,53%,17,,,Layer 02
"Màn hình Viewsonic VA2432A-H 24"" IPS 120Hz viền mỏng",LCD,"3,590,000","2,050,000","990,000","1,060,000",43%,72%,21,,,Layer 01
"Màn hình Viewsonic VA2432A-H 24"" IPS 120Hz viền mỏng",LCD,"3,590,000","2,090,000","1,990,000","100,000",42%,45%,KGH,,,Layer 02
Tay cầm điện thoại Razer Kishi V2 USB-C (RZ06-05110100-R3M1),Peri,"2,390,000","2,390,000","1,400,000","990,000",41%,41%,10,,,Layer 02
"Màn hình LG 27GS95QE-B UltraGear 27"" OLED 2K 240Hz G-Sync",LCD,"24,990,000","14,790,000","14,590,000","200,000",41%,42%,KGH,,,Layer 02
Ghế công thái học E-Dra EEC228,Peri,"1,790,000","1,490,000","890,000","600,000",40%,50%,20,,,Layer 02
"Màn hình LG 45GS95QE-B UltraGear 45"" OLED 2K 240Hz G-Sync",LCD,"41,290,000","24,890,000","23,900,000","990,000",40%,42%,KGH,,,Layer 02
Ghế DXRACER Master-Microfiber Leather-Black-Black Stitches-XL (GC/XLME23LTD/N),Peri,"9,900,000","9,900,000","5,990,000","3,910,000",39%,39%,6,,,Layer 02
Ghế DXRACER GAMING CHAIR Master-Microfiber Leather-Coffee-XL (GC/XLME23LTD/C),Peri,"9,900,000","9,900,000","5,990,000","3,910,000",39%,39%,5,,,Layer 02
Ghế DXRACER GAMING CHAIR Master-Microfiber Leather-Red-XL (GC/XLME23LTD/R),Peri,"9,900,000","9,900,000","5,990,000","3,910,000",39%,39%,5,,,Layer 02
Tai nghe Onikuma In-ear T20 TWS Bluetooth Đen,Peri,"840,000","640,000","390,000","250,000",39%,54%,61,,,Layer 02
Tai nghe Onikuma In-ear T20 TWS Bluetooth Trắng,Peri,"840,000","640,000","390,000","250,000",39%,54%,30,,,Layer 02
Tai nghe Onikuma In-ear T302 TWS RGB Bluetooth Hồng,Peri,"840,000","640,000","390,000","250,000",39%,54%,20,,,Layer 02
Tai nghe Onikuma In-ear T302 TWS RGB Bluetooth Xám Trắng,Peri,"840,000","640,000","390,000","250,000",39%,54%,16,,,Layer 02
Ghế công thái học WARRIOR Ergonomic Marshal WEC620,Peri,"4,790,000","4,790,000","2,990,000","1,800,000",38%,38%,5,,,Layer 02
Ghế công thái học WARRIOR Ergonomic Marshal WEC630 Black,Peri,"4,790,000","4,790,000","2,990,000","1,800,000",38%,38%,5,,,Layer 02
Ghế công thái học WARRIOR Ergonomic Marshal WEC610 Black,Peri,"4,690,000","4,690,000","2,990,000","1,700,000",36%,36%,5,,,Layer 02
"Màn hình Asus TUF GAMING VG279QE5A-R 27"" IPS 146Hz chuyên game",LCD,"4,990,000","3,190,000","2,890,000","300,000",36%,42%,KGH,,,Layer 02
"Màn hình MSI MAG 273QP QD-OLED X24 27"" QD-OLED 2K 240Hz",LCD,"23,990,000","15,490,000","99,000","15,391,000",35%,100%,1,,,Bốc Thăm - Cuối Ngày
"Màn hình MSI MAG 273QP QD-OLED X24 27"" QD-OLED 2K 240Hz",LCD,"23,990,000","15,490,000","13,190,000","2,300,000",35%,45%,KGH,,,Layer 02
Bàn phím không dây AKKO 3098 RF World Tour London V3 Cream Blue Pro,Peri,"1,690,000","1,390,000","900,000","490,000",35%,47%,44,,,Layer 02
"Màn hình ViewSonic VX3276-2K-MHD-2 32"" IPS 2K 75Hz HDR10",LCD,"8,190,000","5,390,000","4,950,000","440,000",34%,40%,KGH,,,Layer 02
"Màn hình ViewSonic VX2779-HD-PRO 27"" IPS 180Hz chuyên game",LCD,"4,990,000","3,290,000","2,990,000","300,000",34%,40%,KGH,,,Layer 02
"Màn hình GIGABYTE MO27Q28G 27"" WOLED 2K 280Hz chuyên game",LCD,"24,990,000","16,490,000","14,990,000","1,500,000",34%,40%,KGH,,,Layer 02
"Màn hình ViewSonic VX2779A-HD-PRO 27"" IPS 240Hz 1ms chuyên game",LCD,"5,590,000","3,690,000","3,390,000","300,000",34%,39%,KGH,,,Layer 02
Tai nghe Onikuma In-ear T209 Bluetooth Live Translation Đen,Peri,"790,000","590,000","390,000","200,000",34%,51%,10,,,Layer 02
Tai nghe Onikuma In-ear T18 ENC Bluetooth Trắng,Peri,"790,000","590,000","390,000","200,000",34%,51%,9,,,Layer 02
Tai nghe Onikuma In-ear T18 ENC Bluetooth Đen,Peri,"790,000","590,000","390,000","200,000",34%,51%,9,,,Layer 02
VO-THER-CTE-T500-TG-ARGB-SNOW,Case,"3,690,000","2,990,000","1,990,000","1,000,000",33%,46%,3,,https://gearvn.com/products/vo-may-tinh-thermaltake-cte-t500-tg-argb-snow-full-tower,Layer 02
"Màn hình GIGABYTE G25F2 25"" IPS 200Hz chuyên game",LCD,"4,490,000","2,990,000","2,690,000","300,000",33%,40%,KGH,,,Layer 02
BlackShark V2 X For PlayStation,Peri,"1,600,000","1,050,000","700,000","350,000",33%,56%,20,,,Layer 02
"Màn hình MSI MAG 244F 24"" Rapid IPS 200Hz chuyên game",LCD,"3,990,000","2,690,000","1,490,000","1,200,000",33%,63%,9,,,Layer 01
"Màn hình MSI MAG 244F 24"" Rapid IPS 200Hz chuyên game",LCD,"3,990,000","2,690,000","2,190,000","500,000",33%,45%,KGH,,,Layer 02
"Màn hình Asus TUF GAMING VG249QE5A-R 24"" IPS 146Hz chuyên game",LCD,"3,990,000","2,690,000","2,390,000","300,000",33%,40%,KGH,,,Layer 02
"Màn hình LG 27U631A-B 27"" IPS 2K 100Hz HDR10",LCD,"6,590,000","4,490,000","4,050,000","440,000",32%,39%,KGH,,,Layer 02
"Màn hình AOC Q27G11E 27"" IPS 2K 180Hz chuyên game",LCD,"5,990,000","4,090,000","3,790,000","300,000",32%,37%,KGH,,,Layer 02
"Màn hình ViewSonic VA3209-2K-MHD 32"" IPS 2K 75Hz HDR10",LCD,"6,690,000","4,590,000","4,290,000","300,000",31%,36%,KGH,,,Layer 02
"Màn hình E-DRA EGM27F120PV 27"" IPS 120Hz",LCD,"3,190,000","2,190,000","1,790,000","400,000",31%,44%,KGH,,,Layer 02
Tai nghe Razer Kraken V4 X - Minecraft Edition,Peri,"2,890,000","2,890,000","1,990,000","900,000",31%,31%,2,,,Layer 02
"Màn hình LG 24GS60F-B 24"" IPS 180Hz HDR10 Gsync chuyên game",LCD,"4,190,000","2,890,000","2,790,000","100,000",31%,33%,KGH,,,Layer 02
Bàn phím cơ DareU EK75 Full White Dream switch,Peri,"699,000","650,000","450,000","200,000",31%,36%,50,,,Layer 02
"Màn hình Viewsonic VA2732A-H 27"" IPS 120Hz viền mỏng",LCD,"3,590,000","2,490,000","2,390,000","100,000",31%,33%,KGH,,,Layer 02
"Màn hình AOC Q27G40E 27"" Fast IPS 2K 180Hz chuyên game",LCD,"5,990,000","4,190,000","3,690,000","500,000",30%,38%,KGH,,,Layer 02
"Màn hình E-DRA EGM24F120PV 24"" IPS 120Hz",LCD,"2,690,000","1,890,000","1,590,000","300,000",30%,41%,KGH,,,Layer 02
"Màn hình LG 27G850A-B 27"" Nano IPS Black 4K 240Hz-FHD 480Hz chuyên game",LCD,"23,990,000","16,990,000","15,790,000","1,200,000",29%,34%,KGH,,,Layer 02
Giá treo màn hình máy tính North Bayou NB-F80-XV Xám Xanh,LCD,"490,000","350,000","9,000","341,000",29%,98%,21,,,Layer 01
"Màn hình LG 24GS65F-B 24"" IPS 180Hz HDR10 Gsync chuyên game",LCD,"4,390,000","3,150,000","1,990,000","1,160,000",28%,55%,20,,,Layer 02
"Màn hình LG 24GS65F-B 24"" IPS 180Hz HDR10 Gsync chuyên game",LCD,"4,390,000","3,150,000","2,790,000","360,000",28%,36%,KGH,,,Layer 02
"Màn hình E-DRA EGM24F100PV 24"" IPS 100Hz",LCD,"2,490,000","1,790,000","990,000","800,000",28%,60%,20,,,Layer 02
"Màn hình E-DRA EGM24F100PV 24"" IPS 100Hz",LCD,"2,490,000","1,790,000","1,390,000","400,000",28%,44%,KGH,,,Layer 02
Tai nghe Onikuma In-ear T301 TWS Bluetooth Trắng,Peri,"740,000","540,000","390,000","150,000",28%,47%,12,,,Layer 02
Webcam Logitech Brio 500 Pink,Peri,"2,750,000","2,750,000","1,990,000","760,000",28%,28%,2,,,Layer 02
Chuột Razer Deathadder Essential White,Peri,"790,000","410,000","300,000","110,000",27%,62%,5,,,Layer 02
"Màn hình ASUS VA27AQ 27"" IPS 2K 75Hz viền mỏng",LCD,"4,490,000","3,290,000","3,090,000","200,000",27%,31%,KGH,,,Layer 02
"Màn hình Acer KG240Y-X1 24"" IPS 200Hz Gsync chuyên game",LCD,"3,790,000","2,790,000","990,000","1,800,000",26%,74%,15,,,Layer 01
"Màn hình Acer KG240Y-X1 24"" IPS 200Hz Gsync chuyên game",LCD,"3,790,000","2,790,000","2,390,000","400,000",26%,37%,KGH,,,Layer 02
"Màn hình LG 27UP850K-W 27"" IPS 4K HDR USBC Chuyên Đồ họa",LCD,"10,890,000","8,100,000","7,890,000","210,000",26%,28%,KGH,,,Layer 02
Chuột Corsair Katar Pro Wireless,Peri,"1,090,000","790,000","590,000","200,000",25%,46%,30,,,Layer 02
"Màn hình Asus TUF GAMING VG259Q5A 25"" Fast IPS 200Hz Gsync chuyên game",LCD,"3,990,000","2,990,000","2,790,000","200,000",25%,30%,KGH,,,Layer 02
Chuột Razer DeathAdder Essential (RZ01-03850100-R3M1),Peri,"790,000","400,000","300,000","100,000",25%,62%,10,,,Layer 02
MB-MSI-MAG-X870-TOMAHAWK-WF-D5,Mainboard,"10,890,000","10,890,000","8,190,000","2,700,000",25%,25%,KGH,,,Layer 02
"Màn hình ViewSonic VX2479-HD-PRO 24"" IPS 180Hz chuyên game",LCD,"3,390,000","2,550,000","2,390,000","160,000",25%,29%,KGH,,,Layer 02
"Màn hình ASUS ProArt PA278CV 27"" IPS 2K 75Hz USBC chuyên đồ họa",LCD,"10,990,000","8,290,000","7,090,000","1,200,000",25%,35%,10,,,Layer 02
"Màn hình cong ASUS TUF GAMING VG34VQL3A 34"" 2K 180Hz HDR chuyên game",LCD,"10,990,000","8,290,000","7,890,000","400,000",25%,28%,KGH,,,Layer 02
Chuột Rapoo VT9 Air Gaming Không Dây Trắng Tím,Peri,"1,990,000","990,000","750,000","240,000",24%,62%,26,,,Layer 02
"Màn hình ASUS VZ279HG 27"" IPS 120Hz viền mỏng",LCD,"3,790,000","2,890,000","2,690,000","200,000",24%,29%,KGH,,,Layer 02
Chuột DareU Không dây EM911X RGB Đen,Peri,"699,000","380,000","290,000","90,000",24%,59%,100,,,Layer 02
"Màn hình E-DRA EGM25F200H 25"" IPS 200Hz chuyên game",LCD,"3,390,000","2,590,000","990,000","1,600,000",24%,71%,10,,,Layer 02
"Màn hình E-DRA EGM25F200H 25"" IPS 200Hz chuyên game",LCD,"3,390,000","2,590,000","2,090,000","500,000",24%,38%,KGH,,,Layer 02
BlackWidow V3 - Green Switch,Peri,"2,490,000","2,090,000","1,600,000","490,000",23%,36%,5,,,Layer 02
"Màn hình MSI MAG 255PXF 25"" Rapid IPS 300Hz Gsync chuyên game",LCD,"5,990,000","4,590,000","4,190,000","400,000",23%,30%,KGH,,,Layer 02
"Màn hình Viewsonic VA2432-H-2 24"" IPS 100Hz viền mỏng",LCD,"2,590,000","1,990,000","1,790,000","200,000",23%,31%,KGH,,,Layer 02
Bàn di chuột Razer Sphex V3 Ultra Thin-Large,Peri,"390,000","390,000","300,000","90,000",23%,23%,10,,,Layer 02
"Màn hình LG 27U411A-B 27"" IPS 120Hz HDR10 siêu mỏng",LCD,"3,590,000","2,790,000","2,690,000","100,000",22%,25%,KGH,,,Layer 02
"Màn hình Philips 27E2N1500L 27"" IPS 2K 75Hz",LCD,"3,590,000","2,790,000","2,550,000","240,000",22%,29%,KGH,,,Layer 02
"Màn hình ASUS ProArt PA248QV 24"" IPS 75Hz 16:10 chuyên đồ họa",LCD,"6,290,000","4,890,000","1,990,000","2,900,000",22%,68%,2,,,Layer 01
"Màn hình ASUS ProArt PA248QV 24"" IPS 75Hz 16:10 chuyên đồ họa",LCD,"6,290,000","4,890,000","4,690,000","200,000",22%,25%,KGH,,,Layer 02
"Màn hình LG 24U631A-B 24"" IPS 2K 100Hz USBC",LCD,"4,990,000","3,900,000","3,690,000","210,000",22%,26%,KGH,,,Layer 02
"Màn hình Philips 27M2N3500PF 27"" IPS 2K 260Hz chuyên game",LCD,"5,990,000","4,690,000","4,090,000","600,000",22%,32%,10,,,Layer 02
"Màn hình Asus ROG Strix XG32UCWMG 32"" WOLED 4K 240Hz-FHD 480Hz chuyên game",LCD,"37,990,000","29,790,000","27,690,000","2,100,000",22%,27%,KGH,,,Layer 02
"Màn hình AOC 25B36X 25"" IPS 144Hz chuyên game",LCD,"2,790,000","2,190,000","1,950,000","240,000",22%,30%,KGH,,,Layer 02
"Màn hình MSI MAG 274QF X24 27"" Rapid IPS 2K 240Hz chuyên game",LCD,"6,990,000","5,490,000","4,650,000","840,000",21%,33%,KGH,,,Layer 02
"Màn hình ASUS VZ249HG 24"" IPS 120Hz viền mỏng",LCD,"2,990,000","2,350,000","990,000","1,360,000",21%,67%,9,,,Layer 01
"Màn hình ASUS VZ249HG 24"" IPS 120Hz viền mỏng",LCD,"2,990,000","2,350,000","2,090,000","260,000",21%,30%,KGH,,,Layer 02
Bàn phím cơ DareU EK75 Grey Black Dream switch,Peri,"699,000","570,000","450,000","120,000",21%,36%,50,,,Layer 02
"Màn hình LG 27UP600K-W 27"" IPS 4K HDR10",LCD,"6,890,000","5,490,000","5,290,000","200,000",20%,23%,KGH,,,Layer 02
"Màn hình MSI PRO MP243L E14 24"" IPS 144Hz",LCD,"2,990,000","2,390,000","2,090,000","300,000",20%,30%,KGH,,,Layer 02
"Màn hình ViewSonic VX2479A-HD-PRO 24"" IPS 240Hz 1ms chuyên game",LCD,"4,490,000","3,590,000","2,590,000","1,000,000",20%,42%,KGH,,,Layer 02
"Màn hình GIGABYTE M27QA 27"" IPS 2K 180Hz chuyên game",LCD,"6,990,000","5,590,000","4,690,000","900,000",20%,33%,KGH,,,Layer 02
Chuột Razer Basilisk V3,Peri,"1,390,000","990,000","800,000","190,000",19%,42%,5,,,Layer 02
"Màn hình AOC 27B36X 27"" IPS 144Hz chuyên game",LCD,"3,190,000","2,590,000","2,350,000","240,000",19%,26%,KGH,,,Layer 02
Tai nghe HP HYPERX Cloud Earbuds II Red,Peri,"1,090,000","849,000","690,000","159,000",19%,37%,30,,,Layer 02
Tai nghe HP HYPERX Cloud Earbuds II Black,Peri,"1,090,000","849,000","690,000","159,000",19%,37%,30,,,Layer 02
"Màn hình ViewSonic VX2758A-2K-PRO-4 27"" IPS 2K 180Hz chuyên game",LCD,"5,990,000","4,890,000","99,000","4,791,000",18%,98%,2,"1 - Con làm social
1 - Con GA trong Ngày",,Bốc Thăm - Cuối Ngày
"Màn hình ViewSonic VX2758A-2K-PRO-4 27"" IPS 2K 180Hz chuyên game",LCD,"5,990,000","4,890,000","4,290,000","600,000",18%,28%,KGH,,,Layer 02
SSD-SAM-990-PRO-M2-NVME-4TB,SSD,"11,990,000","10,990,000","8,990,000","2,000,000",18%,25%,3,,https://gearvn.com/products/o-cung-ssd-samsung-990-pro-4tb-m2-pcie-gen4-nvme,Layer 02
"Màn hình ASUS TUF GAMING VG27AQM5A 27"" Fast IPS 2K 300Hz chuyên game",LCD,"8,490,000","6,990,000","6,390,000","600,000",18%,25%,KGH,,,Layer 02
"Màn hình Asus ROG Strix XG27ACDMS 27"" QD-OLED 2K 280Hz Gsync chuyên game",LCD,"19,990,000","16,490,000","14,890,000","1,600,000",18%,26%,KGH,,,Layer 02
"Màn hình GIGABYTE M27UP 27"" IPS 4K 160Hz-FHD 320Hz chuyên game",LCD,"11,990,000","9,900,000","9,090,000","810,000",17%,24%,KGH,,,Layer 02
Tai nghe Razer BlackShark V2 X,Peri,"1,990,000","1,090,000","900,000","190,000",17%,55%,10,,,Layer 02
VGA-GIG-RTX5090-AOR-M-ICE-32G,Card màn hình,"110,000,000","109,990,000","90,990,000","19,000,000",17%,17%,KGH,,,Layer 02
"Màn hình Philips 27M2N3500UK 27"" IPS 2K 300Hz chuyên game",LCD,"7,590,000","6,290,000","5,590,000","700,000",17%,26%,KGH,,,Layer 02
MB-ASU-Z790-A-ROG-STRIX-GAM-WIFI-II-D5,Mainboard,"14,990,000","9,990,000","8,290,000","1,700,000",17%,45%,KGH,,,Layer 02
"Màn hình Acer KG270-X1 27"" IPS 200Hz Gsync chuyên game",LCD,"4,190,000","3,490,000","3,100,000","390,000",17%,26%,KGH,,,Layer 02
"Màn hình ASUS TUF GAMING VG27AQ5A 27"" Fast IPS 2K 210Hz chuyên game",LCD,"5,990,000","4,990,000","4,590,000","400,000",17%,23%,KGH,,,Layer 02
"Màn hình AOC Q27G42ZE 27"" Fast IPS 2K 260Hz chuyên game",LCD,"5,990,000","4,990,000","4,290,000","700,000",17%,28%,KGH,,,Layer 02
"Màn hình Acer VG271U M3 27"" IPS 2K 180Hz chuyên game",LCD,"5,490,000","4,590,000","3,790,000","800,000",16%,31%,KGH,,,Layer 02
VGA-GIG-RX7600-GAME-O8G,Card màn hình,"8,490,000","7,990,000","6,690,000","1,300,000",16%,21%,1,,https://gearvn.com/products/card-man-hinh-gigabyte-radeon-rx-7600-gaming-oc-8gb-gddr6,Layer 02
"Màn hình E-DRA EGM22F100H 22"" IPS 100Hz",LCD,"1,890,000","1,590,000","1,290,000","300,000",16%,32%,KGH,,,Layer 02
"Màn hình cong GIGABYTE G34WQC2 34"" 2K 200Hz chuyên game",LCD,"8,990,000","7,590,000","7,290,000","300,000",16%,19%,KGH,,,Layer 02
"Màn hình MSI MAG 274F 27"" Rapid IPS 200Hz chuyên game",LCD,"3,990,000","3,390,000","2,890,000","500,000",15%,28%,KGH,,,Layer 02
"Màn hình MSI MAG 245F X24 24"" Rapid IPS 240Hz chuyên game",LCD,"3,990,000","3,390,000","2,790,000","600,000",15%,30%,KGH,,,Layer 02
MB-GIG-B860M-K-D5,Mainboard,"3,990,000","3,390,000","2,890,000","500,000",15%,28%,KGH,,,Layer 02
"Màn hình cong ViewSonic VX3418C-2K 34"" 2K 180Hz chuyên game",LCD,"8,900,000","7,590,000","7,090,000","500,000",15%,20%,KGH,,,Layer 02
"Màn hình Philips 27M3N3540Q 27"" IPS 2K 210Hz chuyên game",LCD,"4,990,000","4,290,000","3,690,000","600,000",14%,26%,10,,,Layer 02
"Màn hình MSI MAG 255XF 25"" Rapid IPS 300Hz FreeSync Premium chuyên game",LCD,"4,990,000","4,290,000","3,900,000","390,000",14%,22%,KGH,,,Layer 02
"Màn hình Philips 27M2N3500PA 27"" IPS 2K 260Hz chuyên game",LCD,"5,990,000","5,190,000","4,490,000","700,000",13%,25%,KGH,,,Layer 02
MB-MSI-Z790-GAM-PLU-WF-D5,Mainboard,"6,990,000","5,990,000","5,190,000","800,000",13%,26%,KGH,,,Layer 02
MB-MSI-PRO-H610M-S-WF-D4,Mainboard,"2,990,000","2,290,000","1,990,000","300,000",13%,33%,KGH,,,Layer 02
MB-GIG-H610M-H-V3-D4,Mainboard,"1,990,000","1,890,000","1,650,000","240,000",13%,17%,KGH,,,Layer 02
"Màn hình AOC 24G11ZE 24"" Fast IPS 240Hz chuyên game",LCD,"3,190,000","2,790,000","2,550,000","240,000",13%,20%,KGH,,,Layer 02
"Màn hình AOC U27G4 27"" Fast IPS 4K 160Hz-FHD 320Hz chuyên game",LCD,"7,990,000","6,990,000","6,590,000","400,000",13%,18%,KGH,,,Layer 02
VGA-GIG-RTX4080S-AOR-XTRE-ICE-16G,Card màn hình,"59,990,000","39,990,000","35,000,000","4,990,000",12%,42%,1,,https://gearvn.com/products/card-man-hinh-gigabyte-aorus-geforce-rtx-4080-super-xtreme-ice-16g,Layer 02
MB-GIG-B760M-GAM-PLUS-WF-D4,Mainboard,"3,590,000","3,290,000","2,890,000","400,000",12%,19%,KGH,,,Layer 02
VGA-ZOT-RTX5060TI-TWIN-EDGE-OC-8GB,Card màn hình,"14,990,000","13,990,000","12,290,000","1,700,000",12%,18%,30,,https://gearvn.com/products/card-man-hinh-zotac-geforce-rtx-5060-ti-16gb-twin-edge-oc,Layer 02
"Màn hình ViewSonic VA2708-2K-MHD 27"" IPS 2K 100Hz",LCD,"4,190,000","3,690,000","3,390,000","300,000",12%,19%,KGH,,,Layer 02
"Màn hình ASUS ProArt PA248QFV 24"" IPS 100Hz 16:10 chuyên đồ họa",LCD,"5,990,000","5,290,000","4,890,000","400,000",12%,18%,KGH,,,Layer 02
"Màn hình LG 24U411A-B 24"" IPS 120Hz HDR10 siêu mỏng",LCD,"2,590,000","2,290,000","2,250,000","40,000",12%,13%,KGH,,,Layer 02
VGA-ASU-RTX5050-DUAL-8GB,Card màn hình,"8,290,000","7,890,000","6,990,000","900,000",11%,16%,KGH,,,Layer 02
VGA-MSI-RTX5090-GAM-TRIO-OC-32G,Card màn hình,"97,990,000","89,990,000","79,990,000","10,000,000",11%,18%,KGH,,,Layer 02
VGA-MSI-RTX5070-GAM-TRIO-OC-WHI-12G,Card màn hình,"23,490,000","23,490,000","20,990,000","2,500,000",11%,11%,KGH,,,Layer 02
VGA-MSI-RTX5060TI-SHADOW-2X-OC-PLUS-16GB,Card màn hình,"14,990,000","14,490,000","12,990,000","1,500,000",10%,13%,KGH,,,Layer 02
VGA-GIG-RTX5090-AOR-M-ICE-32G,Card màn hình,"110,000,000","99,000,000","89,000,000","10,000,000",10%,19%,1,,https://gearvn.com/products/card-man-hinh-gigabyte-aorus-geforce-rtx-5090-master-ice-32g,Layer 02
"Màn hình E-DRA EGM27Q200 27"" IPS 2K 200Hz chuyên game",LCD,"3,990,000","3,590,000","3,090,000","500,000",10%,23%,KGH,,,Layer 02
VGA-MSI-RTX5070TI-SHADOW-3X-OC-16GB,Card màn hình,"27,990,000","26,490,000","23,990,000","2,500,000",9%,14%,KGH,,,Layer 02
"Màn hình AOC 25G4K 25"" Fast IPS 420Hz chuyên game",LCD,"7,490,000","6,790,000","5,850,000","940,000",9%,22%,KGH,,,Layer 02
CPU-INT-I5-13400 (GIảm còn 4.990k khi mua cùng 1 main H7/B7 bất kỳ),CPU,"5,890,000","5,490,000","4,990,000","500,000",9%,15%,50,,,Layer 02
VGA-MSI-RTX5060-VENTUS-2X-OC-8GB,Card màn hình,"10,490,000","9,690,000","8,880,000","810,000",8%,15%,KGH,,,Layer 02
VGA-ASU-RX9070-XT-RADE-PRIME-O16G,Card màn hình,"24,990,000","23,490,000","21,590,000","1,900,000",8%,14%,1,,https://gearvn.com/products/card-man-hinh-asus-prime-radeon-rx-9070-xt-oc-edition-16gb,Layer 02
